@odata.etag,ItemInternalId,ID,Category,Vertical,Products,Problem / Use Case Title,Buying Trigger,Customer Challenge,How Keysight Solves It,Technical Capabilities,Business Outcome
,d03f0463-41ec-4264-a6bf-88a019161eeb,101,Core,Federal,"IxNetwork, AresONE",Federal data center modernization — 400G/800G infrastructure validation,"Data center upgrade, backbone refresh, FedRAMP cloud migration","Government agencies upgrading to 400G/800G must validate routing scale, latency, and failover. Failures can impact mission-critical operations and delay program timelines.",IxNetwork and AresONE emulate large-scale routing tables and high-density traffic to validate network performance before deployment.,"400G/800G traffic generation, BGP/OSPF scale testing, Latency benchmarking, Failover validation",Reduced deployment risk and on-schedule infrastructure modernization for federal programs.
,407ac787-cdf5-4e96-a33f-78be072020dd,102,Core,Federal,"BreakingPoint, CyPerf",Zero Trust Architecture (ZTA) performance and policy validation,"CISA Zero Trust mandate, EO 14028 compliance deadline, CMMC requirement","Federal agencies deploying ZTA must ensure security controls do not degrade performance or break applications, while meeting OMB M-22-09 and DISA STIG requirements.",BreakingPoint and CyPerf simulate realistic government application traffic and attack scenarios to validate ZTA performance under operational conditions.,"ZTNA policy validation, Application traffic simulation, Performance under attack, Compliance evidence generation","ZTA deployment with validated performance, documented compliance, and reduced mission risk."
,207854c8-5272-4032-b4b5-6ea199f98c4f,103,Core,Federal,"KAI Data Center Builder, AresONE",AI/ML infrastructure network validation for national AI initiatives,"National AI initiative, classified AI program buildout, GPU cluster deployment",Government agencies and DoD organizations building AI infrastructure must validate GPU cluster networking before committing large-scale program budgets.,KAI Data Center Builder emulates AI collective communication patterns using AresONE 800GE appliances to validate fabric performance without deploying real GPUs.,"AI workload emulation, RDMA/RoCEv2 validation, Collective comms benchmarking, Congestion analysis",Validated AI fabric performance enabling confident program go/no-go decisions.
,97428ecd-0272-41d6-951d-7823ebc210e6,104,Core,Federal,Network Emulator,Distributed agency WAN and satellite link emulation for remote operations,"Agency modernization, remote site activation, cloud application rollout",Federal agencies operating across geographically distributed sites including forward-deployed and satellite-connected locations need to validate application behavior under degraded WAN conditions.,"Network Emulator recreates SATCOM, WAN impairments, and classified circuit conditions to validate mission-critical application performance before field deployment.","SATCOM/WAN impairment modeling, Latency/jitter/loss injection, Application QoE testing, Classified circuit simulation",Mission-ready applications validated for all connectivity environments before field deployment.
,a1dd58d1-55a0-4eae-a1e8-232498a39a5b,105,Core,Federal,Threat Simulator,CMMC/NIST continuous security validation and audit readiness,"CMMC certification cycle, annual NIST CSF assessment, ATO renewal","Federal agencies and defense contractors must continuously validate security controls and demonstrate compliance with NIST CSF, CMMC, and FedRAMP requirements.","Threat Simulator safely exercises 50,000+ TTPs mapped to MITRE ATT&CK on live agency networks, generating compliance-ready reports for auditors and authorizing officials.","MITRE ATT&CK-mapped simulation, Safe live network testing, SIEM correlation, ATO evidence generation",Continuous ATO-ready compliance posture with measurably improved security control coverage.
,ab215928-430d-47b0-bcd5-4277777f6c26,106,Core,Federal,IxChariot,Collaboration and mission application performance for remote federal workforce,"Telework mandate, DEOS/Teams rollout, unified communications deployment",Federal agencies supporting distributed and remote workforces must ensure collaboration platforms deliver reliable performance across diverse connectivity scenarios.,"IxChariot emulates Teams, VTC, and classified collaboration application behavior across federal network paths, identifying performance bottlenecks before wide-scale rollout.","Collaboration app emulation, VoIP/video QoE measurement, Wi-Fi performance testing, Multi-path analysis",Confident collaboration platform rollout with validated performance for all workforce scenarios.
,c1f26849-b56a-4674-bbf7-bb51a8e9587c,107,Core,Federal,"KAI Data Center Builder, CyPerf, BreakingPoint, IxLoad, Threat Simulator","DND large-scale network test infrastructure modernization — cyber, AI, and application validation","Infrastructure refresh, security posture improvement initiative, emerging AI workload requirements in controlled test environment","The Department of National Defence was modernizing their network test and validation infrastructure under increasing pressure to support secure, high-performance environments tied to evolving cyber and AI-driven workloads. Key gaps included the inability to realistically model real-world traffic and threat conditions, and insufficient validation of infrastructure readiness against modern application and security demands.","Keysight positioned a centralized, scalable test architecture anchored by KAI Data Center Builder, CyPerf, BreakingPoint, IxLoad, and Threat Simulator — creating a foundational test and validation layer enabling DND to continuously validate infrastructure across three workstreams: network performance validation, cybersecurity testing, and AI workload simulation, all before production deployment.","Real-world traffic and attack simulation at scale, AI workload emulation and fabric validation, Application and security performance benchmarking, Centralized multi-use-case test architecture, Continuous pre-production infrastructure validation","DND gained a scalable, centralized test platform validating network performance, cyber resilience, and AI infrastructure readiness — reducing deployment risk across modernization programs with a clear procurement and delivery roadmap."
,6ee91456-039e-4d1f-9587-60d1d623f383,201,Core,Enterprise,"IxNetwork, AresONE, Novus",Data center fabric performance validation — 400G/800G migration,"Data center refresh, 400G migration, AI infrastructure buildout","Enterprise customers building modern data centers must validate fabric performance, ECMP behavior, and routing scale. Poor validation leads to production outages and latency degradation.","IxNetwork, AresONE, and Novus emulate large-scale traffic, validate ECMP fairness, measure congestion, and benchmark latency across the full switching fabric.","400G/800G traffic generation, ECMP validation, Congestion testing, Latency benchmarking, Multi-tenant simulation",Reduced deployment risk and improved data center performance predictability at scale.
,4738215b-1073-4739-a656-3797aeb793c1,202,Core,Enterprise,"BreakingPoint, CyPerf",NGFW and SASE security platform performance validation,"Firewall refresh, SASE rollout, zero trust transformation, security vendor selection","Enterprise security teams need to validate that NGFW, SASE, and zero trust solutions deliver contracted performance under realistic mixed traffic and attack conditions.","BreakingPoint and CyPerf simulate real-world application traffic and attack patterns simultaneously, benchmarking security platform performance under production-like conditions.","Mixed traffic and attack simulation, TLS inspection performance, SASE/SD-WAN validation, Zero trust policy testing",Data-driven security vendor selection and confident platform deployment with validated performance.
,11aa6f11-2886-4990-942d-7a249d4010f9,203,Core,Enterprise,IxChariot,"Hybrid workforce application quality of experience — Teams, SaaS, UC","SaaS migration, UC platform rollout, branch refresh, remote work expansion",Enterprise IT teams supporting hybrid workforces lack clear visibility into whether the network or application is causing performance issues for business-critical tools.,"IxChariot emulates Teams, Zoom, Salesforce, and other business applications, measuring end-to-end QoE and isolating network-layer root causes across all workforce scenarios.","Business app emulation, End-to-end QoE measurement, Wireless performance testing, Multi-site analysis",Improved workforce productivity and faster root-cause resolution for application performance issues.
,14c624a6-c63b-4c60-b797-601efad5a6c9,204,Core,Enterprise,"KAI Data Center Builder, AresONE",Enterprise AI infrastructure — GPU cluster fabric validation,"Enterprise AI deployment, GPU cluster purchase, AI center of excellence buildout",Enterprises deploying AI training or inference infrastructure face congestion risk and uncertainty about whether the network can sustain GPU-driven traffic patterns at scale.,"KAI Data Center Builder emulates realistic AI workload patterns using the KAI Workload Library, validating fabric performance before expensive GPU deployment begins.","AI workload library emulation, Collective comms testing, RDMA congestion validation, Fabric benchmarking",Reduced enterprise AI deployment risk and accelerated time to production for AI workloads.
,0afc281d-3a23-483d-aaf9-54d524fafc8c,205,Core,Enterprise,Threat Simulator,Enterprise security control effectiveness and SOC validation,"SOC modernization, security tool consolidation, executive risk review",Enterprise security teams need continuous assurance that their security stack is effective against current threats without disrupting business operations.,"Threat Simulator safely exercises security controls against 50,000+ real-world TTPs on live enterprise networks, providing gap analysis and vendor-specific remediation guidance.","Safe live BAS, Security gap analysis, SIEM integration, Vendor-specific remediation",Maximized ROI on security investments with measurable and reportable security posture improvement.
,461080b1-cc85-40d2-ba93-856dd5012ad4,206,Core,Enterprise,Network Emulator,SD-WAN and branch office network validation before enterprise-wide rollout,"SD-WAN migration, WAN optimization initiative, branch network refresh","Enterprises adopting SD-WAN must validate failover, QoS, and application behavior across diverse WAN conditions before deploying to hundreds of branch sites.","Network Emulator recreates diverse WAN impairments to validate SD-WAN performance, failover logic, and application QoE across all branch connectivity scenarios.","WAN condition emulation, SD-WAN failover testing, QoS policy validation, Multi-path testing",Confident SD-WAN rollout with predictable application performance across all enterprise locations.
,21d3b8ab-6ee8-4daa-94a8-9dcf0a447416,207,Core,Enterprise,"CloudStorm, IxLoad",SaaS and cloud platform performance testing at enterprise scale,"Cloud migration, SaaS platform launch, digital transformation initiative",Enterprises migrating to cloud-native SaaS must validate application performance under realistic enterprise-scale user loads before production cutover.,CloudStorm and IxLoad simulate large enterprise user populations executing realistic application workflows to validate cloud platform performance and capacity.,"Enterprise-scale user simulation, Application transaction modeling, Cloud platform load testing, ADC/CDN validation",Confident cloud platform launch with validated capacity and performance for enterprise user populations.
,99297eb3-4c07-45e7-8c5a-a6c04326721e,301,Core,Financial,"CloudStorm, IxLoad",Digital banking platform peak load testing and capacity validation,"Digital banking launch, mobile banking growth, payment platform upgrade",Financial institutions operating digital banking and payment platforms face unpredictable traffic spikes that can cause outages during high-value customer moments.,CloudStorm and IxLoad simulate millions of concurrent banking users executing realistic transaction flows to validate platform capacity and identify bottlenecks.,"Millions of concurrent users, Banking transaction emulation, Peak load simulation, Infrastructure bottleneck identification",Reduced risk of customer-impacting outages during peak banking events.
,9eb9e3d5-4e83-4a32-90d2-6b30ede8efd4,302,Core,Financial,"PerfectStorm, BreakingPoint",TLS inspection and encrypted traffic security performance validation,"Firewall upgrade, TLS inspection deployment, encryption compliance mandate",Banks deploying TLS inspection and modern security architectures must validate that encryption processing does not introduce unacceptable latency or throughput degradation.,PerfectStorm and BreakingPoint simulate high-volume encrypted banking traffic with simultaneous attack scenarios to validate security performance under real financial workloads.,"TLS 1.3 performance testing, Encrypted traffic simulation, Security latency benchmarking, Mixed workload testing",Deployment confidence for TLS inspection with validated performance within acceptable latency bounds.
,d107f96e-f4eb-4a01-b8c3-427ac33bfcbf,303,Core,Financial,BreakingPoint,DDoS resilience and attack simulation for banking infrastructure,"DDoS protection refresh, regulatory resilience requirement, SOC validation",Financial institutions are prime DDoS targets. Security infrastructure must be validated against modern multi-vector attacks before incidents impact customer operations.,"BreakingPoint simulates sophisticated volumetric, protocol, and application-layer DDoS attacks at hyperscale, validating mitigation platform effectiveness and failover.","Multi-vector DDoS simulation, Application-layer attack testing, Mitigation platform validation, Resilience scoring",Validated DDoS resilience with documented test evidence for regulatory examinations.
,3e863fd3-f402-439a-960b-702d80046058,304,Core,Financial,"Novus, IxNetwork",Ultra-low latency trading network validation — sub-microsecond performance,"Trading system upgrade, exchange connectivity, new venue onboarding",Trading environments require deterministic sub-microsecond latency. Microbursts and congestion directly impact execution timing and trading revenue.,Novus generates traffic with 2.5ns latency resolution and microburst patterns to validate trading network determinism and benchmark performance against SLAs.,"Sub-microsecond latency measurement, Microburst simulation, Line-rate traffic generation, Determinism validation",Validated trading network performance with quantified latency characteristics for SLA compliance.
,4a494d93-0b5f-4958-95f1-d01b7d58b979,305,Core,Financial,CyPerf,Open banking API security and cloud-native fintech validation,"Open banking initiative, PSD2 compliance, cloud-native fintech launch","Financial institutions offering open banking APIs must validate API security, performance, and scalability under realistic developer and partner traffic loads.",CyPerf validates cloud-native API security and performance using realistic application traffic across distributed and hybrid financial service environments.,"API security testing, Cloud-native validation, SASE/zero trust policy testing, Performance under attack",Secure open banking platform with regulatory compliance confidence and validated API performance.
,220f486b-a155-4d7a-a09e-ea8ccd232254,306,Core,Financial,Threat Simulator,PCI-DSS continuous threat simulation and compliance validation,"PCI-DSS audit cycle, annual security assessment, breach prevention initiative",Financial institutions must continuously demonstrate security control effectiveness against payment-specific threats and produce evidence for PCI-DSS and SOX audits.,"Threat Simulator runs continuous breach simulations mapped to payment sector threat frameworks, generating compliance-ready test evidence and remediation guidance.","PCI-DSS-aligned simulation, Financial sector TTPs, Real-time SIEM correlation, Audit-ready reporting",Continuous PCI-DSS compliance assurance with measurably reduced breach risk.
,ec0a9b87-f301-49af-89a3-a8d6e329598e,401,Core,Service Provider,"IxNetwork, AresONE, Novus",Core backbone modernization — 400G/800G routing scale and stability,"Core router refresh, backbone upgrade, 400G/800G network build","Service Providers upgrading backbone infrastructure must validate routing scale, BGP convergence, and traffic distribution at millions of route scale before deployment.",IxNetwork and AresONE emulate millions of BGP routes and high-density traffic to validate backbone stability and convergence times across diverse failure scenarios.,"Million-route BGP emulation, BGP convergence testing, Traffic distribution validation, Failover and recovery testing",Reduced backbone outage risk and confident deployment of 400G/800G core infrastructure.
,9971c366-6062-448f-ad07-f6d3785cde72,402,Core,Service Provider,"IxLoad, IxNetwork",5G core scalability — subscriber growth and control-plane validation,"5G network launch, 5G core upgrade, subscriber base growth milestone",5G introduces massive subscriber scale and control-plane signaling growth that can overwhelm core network elements and impact subscriber quality of experience.,"Keysight emulates millions of 5G subscribers and validates AMF, UPF, and SMF performance under peak load conditions, including handover and mobility scenarios.","5G subscriber emulation, Control plane scale testing, UPF user plane validation, Mobility and handover testing",Reliable 5G core launch with validated subscriber capacity and quality of experience.
,6f1dc185-6dd5-49fe-892b-71f99a43c63c,403,Core,Service Provider,"BreakingPoint, CyPerf",DDoS mitigation platform validation for service provider infrastructure,"DDoS protection platform refresh, scrubbing center buildout, new security service",Service providers face volumetric DDoS attacks that threaten customer services and revenue. Scrubbing and mitigation platforms must be validated at carrier scale.,"BreakingPoint and CyPerf simulate multi-Tbps DDoS scenarios and validate scrubbing center effectiveness, ensuring customer services are protected at carrier scale.","Carrier-scale DDoS simulation, Scrubbing center validation, Attack traffic realism, Customer SLA protection testing",Validated DDoS scrubbing capacity with confidence in protecting customer services at scale.
,54f9b7b9-d411-4018-8f31-1586af661f0b,404,Core,Service Provider,Network Emulator,Edge cloud and MEC application validation for distributed service delivery,"MEC deployment, edge cloud launch, distributed service expansion","As providers extend services to the network edge, diverse and variable network conditions make pre-deployment validation of application and service behavior complex.","Network Emulator recreates WAN impairments, inter-site conditions, and edge connectivity scenarios to validate application behavior in distributed edge deployments.","Edge topology emulation, MEC application testing, WAN impairment modeling, Cloud interconnect testing",Faster edge service launch with validated application performance across all connectivity scenarios.
,3c5f6fa3-7f8c-4eaf-b5ae-bc65e57c1573,405,Core,Service Provider,"KAI Data Center Builder, AresONE",AI-as-a-Service network infrastructure validation before customer launch,"AIaaS product launch, GPU-as-a-Service offering, AI cloud buildout",Service Providers offering GPU and AI cloud services must validate that their network infrastructure can handle GPU collective communication patterns at the scale customers will require.,KAI Data Center Builder validates AI traffic patterns and RDMA performance using AresONE appliances before onboarding first AI cloud customers.,"AI workload emulation, RDMA/RoCEv2 validation, Collective comms benchmarking, Congestion control testing",AI cloud service launch with validated network infrastructure performance and customer SLA confidence.
,df773456-80f8-4098-a8ec-3565c26beb6f,501,Core,Hyperscaler,"AresONE, INPT-1600GE",800GE/1600GE AI and data center fabric silicon qualification,"Next-gen switch/silicon release, 800G/1.6T deployment, AI cluster expansion","Hyperscalers deploying next-generation 800GE and 1600GE infrastructure need to validate silicon, switch ASICs, and optical transceivers at extreme speeds and densities.","AresONE 800GE and INPT-1600GE provide the highest-density PAM4 traffic generation for L1-3 silicon and fabric validation, supporting RoCEv2, RDMA, and full line-rate stress testing.","800GE/1600GE traffic generation, PAM4 L1 validation, Silicon-level ASIC testing, Optical transceiver qualification",Qualified next-gen silicon and infrastructure ready for hyperscale production deployment.
,17e051e2-7cae-460c-ad9d-10b3e7fab492,502,Core,Hyperscaler,"KAI Data Center Builder, AresONE",GPU cluster RDMA fabric benchmarking and optimization at exascale,"New GPU cluster generation, AI training infrastructure buildout, RDMA upgrade",Hyperscalers building GPU-dense clusters need to benchmark and optimize RDMA/RoCEv2 network fabric performance without requiring actual GPU workloads during pre-deployment validation.,KAI Data Center Builder emulates realistic AI collective communication patterns from the KAI Workload Library using AresONE 400G/800G appliances at full cluster scale.,"AI workload library access, 800GE AI host emulation, Collective comms benchmarking, Congestion control optimization",Optimized GPU fabric configuration with validated performance before billion-dollar GPU deployment.
,87ea64fd-0220-45d9-b337-bf0fe2407557,503,Core,Hyperscaler,"BreakingPoint, APS-100/400GE",Hyperscale DDoS mitigation and security platform validation at 3.2 Tbps,"NGFW/DDoS platform scaling, new cloud region launch, security platform release",Hyperscalers deploying cloud-scale security platforms must validate them against multi-terabit attack scenarios that reflect real-world volumetric and application-layer threats.,"BreakingPoint on APS-M8400 generates up to 3.2 Tbps of L4-7 attack traffic with 56M CPS and realistic TLS, validating platform response at hyperscale.","3.2 Tbps L4-7 attack traffic, 56M connections per second, Multi-vector DDoS and TLS, 400GE physical interfaces",Validated hyperscale security platform with confidence in protection capacity against the largest recorded attacks.
,dbf7ca03-a6f0-4da0-8dab-8d9963b8e43f,504,Core,Hyperscaler,CyPerf,Cloud-native security and distributed application validation in CI/CD,"New cloud service launch, security platform update, CI/CD pipeline integration",Hyperscalers must continuously validate security and performance of cloud-native services across thousands of deployments in fast-moving CI/CD environments.,"CyPerf deploys lightweight containerized test agents across any cloud environment to validate security and performance in both pre- and post-deployment scenarios, integrating with CI/CD pipelines.","Containerized test agents, CI/CD pipeline integration, Zero trust policy validation, Cloud-native performance testing",Continuous security and performance assurance embedded in the hyperscaler development lifecycle.
,adf70149-d539-4120-8345-6ac5036cfb03,505,Core,Hyperscaler,"IxLoad, CloudStorm",CDN and ADC performance validation under billions of concurrent connections,"CDN capacity expansion, HTTP/3 rollout, TLS performance optimization","Hyperscalers operating global CDNs must validate HTTP, HTTPS, and video streaming performance under billions of concurrent connections across distributed PoPs.",IxLoad and CloudStorm deliver multi-terabit HTTP/TLS throughput at millions of CPS to validate CDN and ADC performance under realistic global traffic distributions.,"Multi-terabit application throughput, Billions of concurrent connections, HTTP/3 and QUIC validation, Video streaming QoE testing",Optimized global CDN capacity with confidence in handling peak traffic events at scale.
,f336b529-ed8b-4f25-a649-a756da595f80,601,Tier-2,Healthcare,CyPerf,HIPAA-compliant zero trust security validation for clinical networks,"ZTA rollout, HIPAA security risk assessment, cloud EHR migration",Healthcare organizations adopting zero trust must validate that security controls protect patient data without degrading the performance of clinical systems that support direct patient care.,"CyPerf validates zero trust policies using realistic clinical application traffic, confirming HIPAA security control effectiveness without disrupting care delivery workflows.","Zero trust policy validation, HIPAA-aligned security testing, Clinical app traffic emulation, Cloud security validation",HIPAA-compliant zero trust deployment with no degradation to clinical application performance.
,472ab967-d025-4d39-89eb-09359fef25a3,602,Tier-2,Healthcare,BreakingPoint,Medical network ransomware resilience and attack simulation,"Ransomware prevention initiative, cyber insurance requirement, post-incident hardening",Healthcare organizations face a surge in ransomware targeting medical networks. Security infrastructure must be resilient to healthcare-specific attack vectors without disrupting clinical operations.,BreakingPoint simulates ransomware propagation patterns and healthcare-targeted attacks in an isolated lab environment to validate detection and containment capability.,"Ransomware behavior simulation, Healthcare-targeted attack scenarios, Security resilience testing, Non-disruptive lab validation",Hardened medical network with validated ransomware detection and containment capability.
