,38177c3f-0998-4b53-97a2-8e79ac16f4dd,603,Tier-2,Healthcare,IxChariot,EHR and clinical application performance across distributed health systems,"EHR migration, health system merger, cloud EHR adoption, care team complaints","Health systems relying on cloud EHR platforms must ensure consistent performance for clinicians across hospital sites, outpatient clinics, and telehealth settings.","IxChariot emulates clinical application behavior including EHR, PACS, and collaboration tools, measuring end-to-end performance and identifying network-layer bottlenecks.","EHR/PACS app emulation, Clinical Wi-Fi performance testing, End-to-end QoE measurement, Multi-site performance analysis",Consistent EHR and clinical application performance supporting quality care delivery across all settings.
,980c3178-c12a-4a6c-af0d-40dc7fb85bf6,604,Tier-2,Healthcare,IoT Security Assessment,Medical IoT and connected device security validation — FDA guidance alignment,"FDA cybersecurity guidance compliance, new medical device deployment, IoT audit",Healthcare organizations deploying connected medical devices must validate device security before connecting them to clinical networks and patient care systems.,"IoT Security Assessment automatically discovers vulnerabilities, performs protocol fuzzing, and generates SBOMs for connected medical devices without requiring source code access.","Medical device vulnerability scanning, Protocol fuzzing, FDA-aligned SBOM generation, CVE monitoring for deployed devices",Validated medical device security posture aligned with FDA guidance before network deployment.
,5cbe8f5b-c64b-40dd-8f69-e51ba01c0dc5,605,Tier-2,Healthcare,Network Emulator,Telehealth application quality validation across diverse connectivity,"Telehealth platform expansion, rural health initiative, RPM program launch","Health systems extending telehealth and remote patient monitoring must validate clinical application performance across rural and consumer internet connectivity, which may be highly variable.","Network Emulator recreates rural broadband, consumer internet, and cellular conditions to validate telehealth application performance and video quality under degraded connectivity.","Rural WAN condition emulation, Video QoE testing for telehealth, Packet loss and jitter simulation, RPM device communication testing","Reliable telehealth delivery across all network conditions, supporting equitable care access."
,d790b915-77a8-42dc-9f30-750610f0a826,606,Tier-2,Healthcare,SBOM Manager,Medical device software supply chain security and FDA SBOM compliance,"FDA SBOM mandate, software supply chain audit, medical device procurement","Healthcare organizations must now manage SBOMs for all FDA-regulated devices, tracking software components and newly disclosed CVEs across the entire installed device fleet.","SBOM Manager extracts and validates SBOMs from medical device firmware and software, continuously monitoring for CVEs and generating compliance-ready documentation.","Firmware-level SBOM extraction, CVE continuous monitoring, FDA compliance documentation, Third-party component risk tracking",Continuous medical device supply chain visibility with automated FDA SBOM compliance.
,e14001f4-d3bf-4f1b-a973-eb4dff01a620,701,Tier-2,Manufacturing,Network Emulator,OT/IT convergence — industrial network validation before production cutover,"Smart factory initiative, OT network modernization, Industry 4.0 program",Manufacturers converging OT and IT networks must validate that industrial control systems and SCADA applications behave correctly under converged network conditions without halting production.,Network Emulator recreates industrial WAN and factory floor network conditions to validate OT application behavior in a safe lab environment before production cutover.,"OT/IT convergence simulation, Industrial protocol testing, SCADA communication validation, Production-safe pre-deployment testing",Safe OT/IT convergence with validated control system performance and no production disruption.
,a3aa01bf-25da-4335-8e6c-afb679816629,702,Tier-2,Manufacturing,IxNetwork,Time-Sensitive Networking (TSN) validation for precision industrial automation,"TSN deployment, automotive Ethernet program, precision manufacturing initiative",Manufacturers adopting TSN for robotics and CNC must validate deterministic latency and IEEE 802.1 protocol compliance across multi-vendor industrial ethernet equipment.,IxNetwork validates TSN protocol conformance and deterministic latency with automated Avnu certification testing via Keysight Network Conformance (KNC).,"IEEE 802.1 TSN conformance, Deterministic latency validation, Avnu certification testing, Multi-vendor interoperability",Certified TSN deployment with validated deterministic performance for precision manufacturing operations.
,2104b531-7e58-43e1-988e-bbbb4c0d8259,703,Tier-2,Manufacturing,"BreakingPoint, CyPerf",OT/SCADA attack simulation and industrial security posture validation,"ICS security assessment, ransomware prevention, OT security program launch",Manufacturers must protect OT/SCADA systems from cyberattacks without disrupting industrial operations. Security gaps in OT networks can halt production lines and cause safety incidents.,"BreakingPoint simulates ICS-targeted attack scenarios in an isolated lab environment, validating OT security controls and incident response without touching production equipment.","OT/ICS attack simulation, SCADA security control testing, IT/OT boundary validation, Incident response readiness testing",Validated OT security posture with confidence that cyberattacks will be detected and contained before production impact.
,b69d8a4e-44d8-48b4-b2bc-3ad9ca959db6,704,Tier-2,Manufacturing,IoT Security Assessment,Smart factory IoT device security assessment before production deployment,"Smart factory IoT rollout, OT device procurement, connected device security audit","Manufacturers deploying smart factory sensors, PLCs, and industrial robots must validate device security before connecting them to factory networks and cloud platforms.",IoT Security Assessment performs automated vulnerability assessment including protocol fuzzing and SBOM generation for industrial IoT devices without requiring source code.,"Industrial IoT vulnerability scanning, OT device protocol fuzzing, SBOM generation for IIoT, Automated CVE identification",Secure smart factory deployment with every device security-validated before network connection.
,b1aa8f07-bd46-48ee-a73e-f46fe9c297b9,705,Tier-2,Manufacturing,IxChariot,Factory floor and ERP application performance across global manufacturing sites,"ERP upgrade, MES deployment, factory digitization, global network refresh","Manufacturers digitizing factory operations need to ensure ERP, MES, and production monitoring applications perform reliably across all factory environments globally.","IxChariot emulates manufacturing application behavior and measures end-to-end performance across factory floor networks, Wi-Fi environments, and WAN connections.","Manufacturing app emulation, Factory Wi-Fi performance testing, QoE measurement and reporting, Global multi-site comparison","Reliable ERP and MES performance across all manufacturing sites, supporting operational efficiency and OEE."
,5c819556-4a61-44bf-81f9-f2771ea8762c,801,Tier-2,Retail,"IxLoad, CloudStorm",E-commerce platform performance during peak shopping events,"Holiday season preparation, major sale event, platform re-platform, cloud migration",Retailers operating e-commerce platforms face revenue-impacting outages during Black Friday and flash sales. Platform performance under peak load must be validated before every major event.,"IxLoad and CloudStorm simulate millions of concurrent shoppers executing realistic cart, checkout, and browsing transactions to validate platform performance under extreme peak loads.","Millions of concurrent shoppers, Realistic e-commerce transaction flows, Peak load stress testing, Infrastructure bottleneck identification",Confident e-commerce platform performance during peak events with reduced risk of revenue-impacting outages.
,79e04228-fc35-4e31-832d-5d95eb48ec82,802,Tier-2,Retail,"BreakingPoint, CyPerf",PCI-DSS payment security validation and cardholder data protection,"PCI-DSS audit cycle, payment platform upgrade, card-not-present fraud increase",Retailers processing card payments must validate that security controls protecting cardholder data perform correctly under realistic transaction loads and attack conditions.,"BreakingPoint validates payment platform security under mixed legitimate traffic and attack conditions, providing PCI-DSS-aligned test evidence for compliance audits.","PCI-DSS aligned security testing, Payment platform attack simulation, Mixed traffic validation, Compliance evidence generation",PCI-DSS compliance confidence with validated payment platform security and audit-ready documentation.
,95f64d4d-9be6-4058-8236-604afeb82ee8,803,Tier-2,Retail,Network Emulator,SD-WAN and distributed store network validation for retail chains,"SD-WAN rollout across store fleet, store network refresh, WAN optimization","Retail chains with hundreds of stores must validate that SD-WAN delivers reliable POS, inventory, and digital signage performance across diverse store connectivity scenarios.","Network Emulator recreates diverse store connectivity conditions to validate SD-WAN failover, application prioritization, and performance before fleet-wide rollout.","Store WAN condition simulation, SD-WAN failover validation, POS application performance testing, Multi-store scenario testing",Reliable retail operations across all locations with validated SD-WAN performance before mass deployment.
,661e4907-134c-4391-b87c-dc838679b48a,804,Tier-2,Retail,IxChariot,In-store Wi-Fi and mobile associate application performance,"BOPIS rollout, mobile POS deployment, in-store associate app launch, Wi-Fi upgrade","Modern retailers deploying mobile POS, digital shelf labels, and BOPIS require reliable Wi-Fi performance for associate and customer applications across diverse store layouts.","IxChariot tests in-store Wi-Fi performance for retail applications including mobile POS, inventory, and clienteling under realistic store traffic and interference conditions.","Retail Wi-Fi performance testing, Mobile POS and BOPIS app testing, In-store application QoE, Customer-facing performance validation",Consistent in-store experience for associates and customers with validated Wi-Fi performance at scale.
,45ee289c-6ec0-4fe0-b7d0-8058f744b69e,805,Tier-2,Retail,Threat Simulator,Retail cybersecurity posture validation and loyalty platform protection,"Security breach in retail sector, loyalty platform launch, annual risk assessment",Retailers managing loyalty programs and customer PII face increasing cyberattacks. Security teams need continuous validation without disrupting retail operations.,"Threat Simulator safely simulates retail-targeted attacks on live networks, validating security control effectiveness and identifying gaps in loyalty, POS, and e-commerce protection.","Retail-targeted attack simulation, Safe live network BAS, Security gap identification, Remediation prioritization",Improved retail cybersecurity posture with continuous validation of customer data protection investments.
,f778fe3f-1e55-4553-a055-60d506a0c5d0,901,Tier-2,Technology Companies,"CyPerf, BreakingPoint",Product security testing integrated into DevSecOps CI/CD pipelines,"DevSecOps initiative, security certification, secure SDLC program launch","Technology companies must validate that network products and software meet security requirements before release, integrating testing into rapid agile development cycles.","CyPerf and BreakingPoint integrate with Jenkins, GitLab, and CI/CD pipelines to automatically validate security and performance with each build, catching issues pre-release.","CI/CD pipeline integration, Automated security regression testing, API-driven test orchestration, Shift-left security validation","Faster, more secure product delivery with security issues identified and resolved early in development."
,aa087808-70cb-40e2-839b-2c80693b18ad,902,Tier-2,Technology Companies,"IxLoad, IxNetwork",Network equipment and silicon performance validation for product launch,"New product release, ASIC development milestone, NE/silicon launch","Technology companies building network equipment and silicon must validate throughput, latency, and scale performance against RFC benchmarks before market launch.",IxLoad and IxNetwork provide RFC-compliant benchmarking and full line-rate L2-7 traffic generation to validate NE and silicon performance for product qualification.,"RFC benchmark testing, Full line-rate validation, ASIC and silicon performance testing, L2-7 comprehensive testing","Products ship with independently validated performance benchmarks, accelerating customer acceptance and sales cycles."
,84d2a740-f0f1-44a8-9190-1344e15f229b,903,Tier-2,Technology Companies,SBOM Manager,Software supply chain security and product SBOM compliance,"US EO 14028 SBOM requirement, enterprise customer SBOM request, open source audit","Technology companies shipping software products must now generate and manage SBOMs for all products, tracking components and vulnerabilities across every product version.","SBOM Manager automatically extracts SBOMs from software binaries and firmware at build time, continuously monitors for new CVEs, and integrates with existing vulnerability management.","Automated binary SBOM extraction, CVE continuous monitoring, CI/CD SBOM integration, Customer-ready SBOM delivery",Automated product SBOM compliance with continuous visibility into software supply chain risk across product lines.
,d332993b-c58d-4205-8840-270872930c40,904,Tier-2,Technology Companies,"KAI Data Center Builder, AresONE",AI product development infrastructure validation and GPU fabric benchmarking,"AI product launch, ML training cluster buildout, AI chip validation program","Technology companies building AI products need validated network infrastructure for their AI development, training, and inference operations before committing to major CapEx.",KAI Data Center Builder benchmarks AI fabric performance using realistic workload traces from the KAI Workload Library without requiring full GPU cluster deployment.,"AI workload library-based testing, Fabric performance benchmarking, Pre-deployment ROI validation, RDMA traffic analysis",Optimized AI development infrastructure with validated performance before large capital commitment.
,0ba45ca8-bb48-4610-8b69-abdf0ed71f8f,905,Tier-2,Technology Companies,IxANVL,Network protocol RFC conformance and standards compliance validation,"Protocol certification requirement, standards compliance, RFC validation milestone",Technology companies building networking products must validate that protocol implementations are RFC-compliant and interoperate correctly with industry standards across vendors.,"IxANVL provides comprehensive automated protocol conformance testing, emulating large multi-node networks to verify RFC/standard compliance without requiring physical hardware at scale.","RFC conformance test suites, Multi-node protocol emulation, Linux/Windows lightweight deployment, Protocol stack compliance verification","RFC-compliant products with validated interoperability, accelerating customer acceptance and standards certification."
,f604b4c8-48a7-4108-849c-afaab9c6aa41,906,Tier-2,Technology Companies,KENG,Cloud-native and containerized network infrastructure validation with open APIs,"DevOps/NetOps modernization, open-source test initiative, CI/CD network testing program","Technology companies building modern software-defined networking products need automated, open-API-based validation that integrates with containerized development workflows and CI/CD pipelines.","Keysight Elastic Network Generator (KENG) delivers containerized L1-3 traffic generation and protocol emulation based on the open Open Traffic Generator (OTG) API, enabling scripted automated validation in any cloud or container environment.","Open Traffic Generator (OTG) API, Container/microservices architecture, DPDK-accelerated traffic generation, snappi/gosnappi scripting support, CI/CD pipeline integration","Automated, repeatable network validation embedded in modern development workflows with open-source flexibility."
,dc9c754c-3211-47c2-a9f3-aa44c1f9682c,1001,Tier-2,Energy,Network Emulator,Power grid OT/IT convergence — SCADA network validation,"Grid modernization program, OT/IT convergence initiative, SCADA WAN upgrade",Energy utilities converging OT and IT networks must validate that grid control system communications remain deterministic and reliable across the new converged network.,Network Emulator recreates power grid communication paths including SCADA circuits and substation WAN links to validate control application behavior before convergence.,"SCADA communication path emulation, Grid control app validation, OT/IT boundary testing, Deterministic timing testing",Safe grid OT/IT convergence with validated SCADA communication performance and no production risk.
,042ce151-4b1a-4add-b0e9-f20dc4f62e21,1002,Tier-2,Energy,"CyPerf, BreakingPoint",NERC CIP compliance and critical infrastructure security validation,"NERC CIP audit deadline, energy sector threat escalation, grid security incident",Electric utilities subject to NERC CIP must validate security controls protecting bulk electric systems and demonstrate compliance without disrupting power generation.,"CyPerf validates security policies in isolated environments mapped to NERC CIP requirements, generating compliance evidence without touching operational generation systems.","NERC CIP-aligned testing, Isolated OT security validation, Compliance evidence generation, Critical infrastructure threat simulation",NERC CIP audit compliance evidence with validated critical infrastructure security posture.
,4f458de1-eb65-4e2f-af96-77e69dc2520a,1003,Tier-2,Energy,IxNetwork,IEC 61850 substation automation and digital grid protocol validation,"Digital substation deployment, smart grid program, IEC 61850 migration","Energy companies deploying digital substations must validate GOOSE, Sampled Values, and MMS protocol performance across multi-vendor substation automation equipment.","IxNetwork validates IEC 61850 protocol conformance and timing performance for digital substations, ensuring interoperability between protection and automation devices.","IEC 61850 GOOSE/SV validation, Digital substation conformance testing, Multi-vendor interoperability, Protection relay timing testing",Validated digital substation deployment with confirmed IEC 61850 interoperability and protection system performance.
,d03361a2-5ea2-40e3-ae55-149a07c0fb15,1004,Tier-2,Energy,IoT Security Assessment,Smart meter and grid-edge AMI device security validation,"AMI deployment program, smart meter rollout, grid-edge device audit",Energy utilities deploying millions of smart meters must validate device security before network-scale rollout to prevent large-scale AMI attacks impacting grid operations.,"IoT Security Assessment performs automated vulnerability assessment and protocol fuzzing on smart meters and grid-edge devices, identifying security gaps before AMI deployment.","Smart meter security assessment, AMI device protocol fuzzing, SBOM generation for grid devices, Grid-edge vulnerability identification",Secure AMI deployment at scale with every smart meter security-validated before network connection.
,e06664d5-b5d6-461f-a1c3-dfdd2ccf1d67,1101,Strategic,AI Infrastructure Providers,"KAI Data Center Builder, AresONE",GPU cluster RDMA fabric benchmarking and collective communications optimization,"New AI cluster generation, RDMA fabric upgrade, AI infra product launch",AI infrastructure providers building GPU-dense clusters need to benchmark and optimize RDMA/RoCEv2 fabric performance without deploying real GPUs during pre-deployment validation.,KAI Data Center Builder uses AresONE 800GE appliances to emulate realistic AI collective communications from the KAI Workload Library at full cluster scale.,"800GE AI host emulation, KAI Workload Library access, Collective comms benchmarking, Congestion control optimization, Job completion time analysis",Optimized AI cluster fabric performance with data-driven configuration decisions before GPU deployment.
,80fe251d-4086-44dd-b968-e143ca0bd571,1102,Strategic,AI Infrastructure Providers,"IxNetwork, AresONE","AI fabric routing, ECMP, and load balancing validation at cluster scale","AI fabric architecture decision, switch vendor evaluation, new cluster topology","AI infrastructure providers selecting fabric topologies and switch vendors need to validate routing scale, ECMP fairness, and congestion control at full cluster scale.","IxNetwork and AresONE emulate AI cluster traffic patterns to validate routing scale, ECMP behavior, and congestion control across different fabric architectures.","AI traffic pattern emulation, ECMP fairness validation, Routing scale testing, Multi-path congestion analysis, Switch vendor benchmarking",Data-driven fabric architecture decision with validated performance at target cluster scale.
,fb6822f5-e329-4f10-a2b1-edbe13831d23,1103,Strategic,AI Infrastructure Providers,"INPT-1600GE, AresONE",800GE/1600GE AI switch silicon and optical transceiver qualification,"Next-gen switch ASIC release, 800G/1.6T optics qualification, silicon tapeout",AI infrastructure silicon and component vendors need to validate chips and optical transceivers at 800GE and beyond before production release to hyperscale customers.,"INPT-1600GE provides comprehensive PAM4 L1-3 validation from BERT to IP at 1600GE, with AresONE delivering large-scale L2-3 protocol and performance validation.","1600GE PAM4 signal testing, Silicon-level L1 validation, Optical transceiver qualification, L2-3 scale performance testing",Qualified AI infrastructure silicon and components with independently validated performance for hyperscale customers.
,34f0d6e0-ebe2-4c79-a9fc-c9de7cca600b,1104,Strategic,AI Infrastructure Providers,"BreakingPoint, CyPerf",AI platform multi-tenant security and model IP protection validation,"AI platform productization, enterprise security review, model leakage concern",AI infrastructure providers offering GPU-as-a-Service must validate security isolation between tenants and protect AI model intellectual property from network-based attacks.,"BreakingPoint and CyPerf validate network isolation, API security, and tenant separation across AI platform infrastructure, testing protection against model extraction attack vectors.","Multi-tenant isolation testing, AI platform attack simulation, API security validation, Network policy enforcement testing",Secure AI platform with validated tenant isolation and model IP protection for enterprise AI customers.
,ce335770-e918-4f77-bdab-b6a91b7a9e99,1201,Strategic,Colocation / Data Centers,"IxNetwork, AresONE",Multi-tenant colo fabric — traffic isolation and performance SLA validation,"New data center build, fabric upgrade, major tenant onboarding, SLA commitment",Colocation providers must validate that their network fabric delivers consistent performance and strict traffic isolation between tenants before committing to customer SLAs.,"IxNetwork and AresONE validate multi-tenant traffic isolation, routing consistency, and fabric performance under realistic mixed-tenant workloads at production scale.","Multi-tenant traffic simulation, Network isolation validation, Fabric performance benchmarking, SLA-aligned testing methodology",Colo fabric validated for customer SLA commitments with documented multi-tenant performance evidence.
,3aee0cb2-cd87-48f0-bc42-3dcd357379aa,1202,Strategic,Colocation / Data Centers,"BreakingPoint, CyPerf",Managed security services and MSSP customer SLA validation,"Managed security service launch, MSSP expansion, new enterprise customer SLA",Colo providers offering managed security services must validate that security platforms deliver contracted protection levels across diverse customer tenant workloads.,"BreakingPoint and CyPerf validate NGFW, DDoS mitigation, and WAF performance under mixed customer traffic and real attack conditions, providing SLA-aligned performance evidence.","NGFW/WAF performance benchmarking, DDoS mitigation capacity testing, Mixed customer traffic simulation, SLA threshold validation",Validated managed security service performance with documented evidence supporting customer SLA commitments.
,cb231a1d-964c-4ad2-b4b0-ae0ada55c609,1203,Strategic,Colocation / Data Centers,"KAI Data Center Builder, AresONE",AI-ready colo infrastructure validation — GPU rack readiness certification,"AI-ready colo product launch, hyperscaler prospect requirement, GPU rack offering",Colocation providers launching AI-ready infrastructure offerings must validate that 400G/800G networking meets the demanding requirements of GPU-dense AI workloads.,KAI Data Center Builder validates AI workload network performance using AresONE appliances to confirm AI readiness and generate customer-facing validation evidence.,"AI workload network validation, GPU rack readiness testing, 400G/800G fabric benchmarking, RoCEv2 performance certification",AI-ready colo product with independently validated performance evidence for hyperscaler and enterprise AI customers.
